{
  "sketchId": "open_polyline",
  "schemaVersion": "1.0",
  "engineVersion": "1.0.0",
  "name": "Open Polyline",
  "units": {
    "length": "mm",
    "angle": "deg"
  },
  "tolerances": {
    "units": "mm",
    "weld_mm": 0.5,
    "geometry_mm": 0.5,
    "cluster_mm": 1,
    "angle_rad": 0.008726646259971648,
    "collinear_rad": 0.05,
    "solver_residual": 1e-8,
    "singular_value_eps": 1e-10,
    "independence_eps": 0.000001,
    "snap_import_mm": 2
  },
  "parameters": {},
  "formulas": [],
  "primitives": {
    "points": {
      "p1": {
        "id": "p1",
        "x": 0,
        "y": 0,
        "fixed": true
      },
      "p2": {
        "id": "p2",
        "x": 200,
        "y": 100
      },
      "p3": {
        "id": "p3",
        "x": 400,
        "y": 50
      },
      "p4": {
        "id": "p4",
        "x": 600,
        "y": 200
      }
    },
    "lines": {
      "l1": {
        "id": "l1",
        "startPointId": "p1",
        "endPointId": "p2"
      },
      "l2": {
        "id": "l2",
        "startPointId": "p2",
        "endPointId": "p3"
      },
      "l3": {
        "id": "l3",
        "startPointId": "p3",
        "endPointId": "p4"
      }
    },
    "arcs": {},
    "circles": {}
  },
  "topology": {
    "halfEdges": {},
    "faces": {}
  },
  "constraints": {}
}