{
  "sketchId": "basic_arc",
  "schemaVersion": "1.0",
  "engineVersion": "1.0.0",
  "name": "Circular Arc",
  "units": {
    "length": "mm",
    "angle": "deg"
  },
  "tolerances": {
    "units": "mm",
    "weld_mm": 0.5,
    "geometry_mm": 0.5,
    "cluster_mm": 1,
    "angle_rad": 0.008726646259971648,
    "collinear_rad": 0.05,
    "solver_residual": 1e-8,
    "singular_value_eps": 1e-10,
    "independence_eps": 0.000001,
    "snap_import_mm": 2
  },
  "parameters": {},
  "formulas": [],
  "primitives": {
    "points": {
      "c": {
        "id": "c",
        "x": 500,
        "y": 500,
        "fixed": true
      }
    },
    "lines": {},
    "arcs": {
      "a1": {
        "id": "a1",
        "centerPointId": "c",
        "radius": 200,
        "startAngle": 0,
        "endAngle": 90
      }
    },
    "circles": {}
  },
  "topology": {
    "halfEdges": {},
    "faces": {}
  },
  "constraints": {}
}