{
  "sketchId": "rotated_rect_37",
  "schemaVersion": "1.0",
  "engineVersion": "1.0.0",
  "name": "Rotated Rectangle 37°",
  "units": {
    "length": "mm",
    "angle": "deg"
  },
  "tolerances": {
    "units": "mm",
    "weld_mm": 0.5,
    "geometry_mm": 0.5,
    "cluster_mm": 1,
    "angle_rad": 0.008726646259971648,
    "collinear_rad": 0.05,
    "solver_residual": 1e-8,
    "singular_value_eps": 1e-10,
    "independence_eps": 0.000001,
    "snap_import_mm": 2
  },
  "parameters": {},
  "formulas": [],
  "primitives": {
    "points": {
      "p1": {
        "id": "p1",
        "x": 0,
        "y": 0,
        "fixed": true
      },
      "p2": {
        "id": "p2",
        "x": 798.6355100472929,
        "y": 601.8150231520483
      },
      "p3": {
        "id": "p3",
        "x": 437.54649615606394,
        "y": 1080.996329180424
      },
      "p4": {
        "id": "p4",
        "x": -361.08901389122894,
        "y": 479.1813060283757
      }
    },
    "lines": {
      "l1": {
        "id": "l1",
        "startPointId": "p1",
        "endPointId": "p2"
      },
      "l2": {
        "id": "l2",
        "startPointId": "p2",
        "endPointId": "p3"
      },
      "l3": {
        "id": "l3",
        "startPointId": "p3",
        "endPointId": "p4"
      },
      "l4": {
        "id": "l4",
        "startPointId": "p4",
        "endPointId": "p1"
      }
    },
    "arcs": {},
    "circles": {}
  },
  "topology": {
    "halfEdges": {},
    "faces": {}
  },
  "constraints": {
    "c1": {
      "id": "c1",
      "type": "PARALLEL",
      "entities": [
        "l1",
        "l3"
      ],
      "strength": "hard",
      "driving": true,
      "isActive": true,
      "predicate": "P1",
      "provenance": "GeometricFact",
      "state": "active"
    },
    "c2": {
      "id": "c2",
      "type": "PERPENDICULAR",
      "entities": [
        "l1",
        "l2"
      ],
      "strength": "hard",
      "driving": true,
      "isActive": true,
      "predicate": "P2",
      "provenance": "GeometricFact",
      "state": "active"
    }
  }
}