{
  "sketchId": "single_cell_culvert",
  "schemaVersion": "1.0",
  "engineVersion": "1.0.0",
  "name": "Single-Cell Box Culvert",
  "units": {
    "length": "mm",
    "angle": "deg"
  },
  "tolerances": {
    "units": "mm",
    "weld_mm": 0.5,
    "geometry_mm": 0.5,
    "cluster_mm": 1,
    "angle_rad": 0.008726646259971648,
    "collinear_rad": 0.05,
    "solver_residual": 1e-8,
    "singular_value_eps": 1e-10,
    "independence_eps": 0.000001,
    "snap_import_mm": 2
  },
  "parameters": {
    "ClearSpan": {
      "id": "p_cs",
      "name": "ClearSpan",
      "role": "DRIVING",
      "type": "LENGTH",
      "value": 3000,
      "unit": "mm",
      "provenance": "UserConstraint"
    },
    "ClearHeight": {
      "id": "p_ch",
      "name": "ClearHeight",
      "role": "DRIVING",
      "type": "LENGTH",
      "value": 2500,
      "unit": "mm",
      "provenance": "UserConstraint"
    },
    "WallThickness": {
      "id": "p_wt",
      "name": "WallThickness",
      "role": "DRIVING",
      "type": "LENGTH",
      "value": 350,
      "unit": "mm",
      "provenance": "UserConstraint"
    },
    "SlabThickness": {
      "id": "p_st",
      "name": "SlabThickness",
      "role": "DRIVING",
      "type": "LENGTH",
      "value": 350,
      "unit": "mm",
      "provenance": "UserConstraint"
    },
    "HaunchSize": {
      "id": "p_hs",
      "name": "HaunchSize",
      "role": "FIXED",
      "type": "LENGTH",
      "value": 150,
      "unit": "mm",
      "provenance": "UserConstraint"
    }
  },
  "formulas": [],
  "primitives": {
    "points": {
      "op1": {
        "id": "op1",
        "x": 0,
        "y": 0,
        "fixed": true
      },
      "op2": {
        "id": "op2",
        "x": 3700,
        "y": 0
      },
      "op3": {
        "id": "op3",
        "x": 3700,
        "y": 3200
      },
      "op4": {
        "id": "op4",
        "x": 0,
        "y": 3200
      },
      "ip1": {
        "id": "ip1",
        "x": 500,
        "y": 350
      },
      "ip2": {
        "id": "ip2",
        "x": 3200,
        "y": 350
      },
      "ip3": {
        "id": "ip3",
        "x": 3350,
        "y": 500
      },
      "ip4": {
        "id": "ip4",
        "x": 3350,
        "y": 2700
      },
      "ip5": {
        "id": "ip5",
        "x": 3200,
        "y": 2850
      },
      "ip6": {
        "id": "ip6",
        "x": 500,
        "y": 2850
      },
      "ip7": {
        "id": "ip7",
        "x": 350,
        "y": 2700
      },
      "ip8": {
        "id": "ip8",
        "x": 350,
        "y": 500
      }
    },
    "lines": {
      "ol1": {
        "id": "ol1",
        "startPointId": "op1",
        "endPointId": "op2"
      },
      "ol2": {
        "id": "ol2",
        "startPointId": "op2",
        "endPointId": "op3"
      },
      "ol3": {
        "id": "ol3",
        "startPointId": "op3",
        "endPointId": "op4"
      },
      "ol4": {
        "id": "ol4",
        "startPointId": "op4",
        "endPointId": "op1"
      },
      "il_bot": {
        "id": "il_bot",
        "startPointId": "ip1",
        "endPointId": "ip2"
      },
      "il_h_br": {
        "id": "il_h_br",
        "startPointId": "ip2",
        "endPointId": "ip3"
      },
      "il_r": {
        "id": "il_r",
        "startPointId": "ip3",
        "endPointId": "ip4"
      },
      "il_h_tr": {
        "id": "il_h_tr",
        "startPointId": "ip4",
        "endPointId": "ip5"
      },
      "il_top": {
        "id": "il_top",
        "startPointId": "ip5",
        "endPointId": "ip6"
      },
      "il_h_tl": {
        "id": "il_h_tl",
        "startPointId": "ip6",
        "endPointId": "ip7"
      },
      "il_l": {
        "id": "il_l",
        "startPointId": "ip7",
        "endPointId": "ip8"
      },
      "il_h_bl": {
        "id": "il_h_bl",
        "startPointId": "ip8",
        "endPointId": "ip1"
      }
    },
    "arcs": {},
    "circles": {}
  },
  "topology": {
    "halfEdges": {},
    "faces": {}
  },
  "constraints": {
    "c_wall_l": {
      "id": "c_wall_l",
      "type": "OFFSET_LINE_TO_LINE",
      "entities": [
        "ol4",
        "il_l"
      ],
      "targetValue": 350,
      "parameterBinding": "p_wt",
      "strength": "driving",
      "driving": true,
      "isActive": true,
      "predicate": "P3",
      "provenance": "UserConstraint",
      "state": "active"
    },
    "c_wall_r": {
      "id": "c_wall_r",
      "type": "OFFSET_LINE_TO_LINE",
      "entities": [
        "ol2",
        "il_r"
      ],
      "targetValue": 350,
      "parameterBinding": "p_wt",
      "strength": "driving",
      "driving": true,
      "isActive": true,
      "predicate": "P3",
      "provenance": "UserConstraint",
      "state": "active"
    },
    "c_slab_b": {
      "id": "c_slab_b",
      "type": "OFFSET_LINE_TO_LINE",
      "entities": [
        "ol1",
        "il_bot"
      ],
      "targetValue": 350,
      "parameterBinding": "p_st",
      "strength": "driving",
      "driving": true,
      "isActive": true,
      "predicate": "P3",
      "provenance": "UserConstraint",
      "state": "active"
    },
    "c_slab_t": {
      "id": "c_slab_t",
      "type": "OFFSET_LINE_TO_LINE",
      "entities": [
        "ol3",
        "il_top"
      ],
      "targetValue": 350,
      "parameterBinding": "p_st",
      "strength": "driving",
      "driving": true,
      "isActive": true,
      "predicate": "P3",
      "provenance": "UserConstraint",
      "state": "active"
    },
    "c_h1": {
      "id": "c_h1",
      "type": "CHAMFER_EQUAL_LEG",
      "entities": [
        "il_h_bl",
        "il_bot",
        "il_l"
      ],
      "targetValue": 150,
      "parameterBinding": "p_hs",
      "strength": "driving",
      "driving": true,
      "isActive": true,
      "predicate": "P4",
      "provenance": "UserConstraint",
      "state": "active"
    }
  }
}