{
  "sketchId": "self_touching_polygon",
  "schemaVersion": "1.0",
  "engineVersion": "1.0.0",
  "name": "Self-Touching Figure 8",
  "units": {
    "length": "mm",
    "angle": "deg"
  },
  "tolerances": {
    "units": "mm",
    "weld_mm": 0.5,
    "geometry_mm": 0.5,
    "cluster_mm": 1,
    "angle_rad": 0.008726646259971648,
    "collinear_rad": 0.05,
    "solver_residual": 1e-8,
    "singular_value_eps": 1e-10,
    "independence_eps": 0.000001,
    "snap_import_mm": 2
  },
  "parameters": {},
  "formulas": [],
  "primitives": {
    "points": {
      "pCenter": {
        "id": "pCenter",
        "x": 300,
        "y": 300,
        "fixed": true
      },
      "p1": {
        "id": "p1",
        "x": 100,
        "y": 200
      },
      "p2": {
        "id": "p2",
        "x": 100,
        "y": 400
      },
      "p3": {
        "id": "p3",
        "x": 500,
        "y": 400
      },
      "p4": {
        "id": "p4",
        "x": 500,
        "y": 200
      }
    },
    "lines": {
      "l1": {
        "id": "l1",
        "startPointId": "pCenter",
        "endPointId": "p1"
      },
      "l2": {
        "id": "l2",
        "startPointId": "p1",
        "endPointId": "p2"
      },
      "l3": {
        "id": "l3",
        "startPointId": "p2",
        "endPointId": "pCenter"
      },
      "l4": {
        "id": "l4",
        "startPointId": "pCenter",
        "endPointId": "p3"
      },
      "l5": {
        "id": "l5",
        "startPointId": "p3",
        "endPointId": "p4"
      },
      "l6": {
        "id": "l6",
        "startPointId": "p4",
        "endPointId": "pCenter"
      }
    },
    "arcs": {},
    "circles": {}
  },
  "topology": {
    "halfEdges": {},
    "faces": {}
  },
  "constraints": {}
}